id,year,context,question,options,correct_answer,CE,DS,EK,IC,MR,TC,image,IU,ledor,figures,description,area,cor,system_answer,steps_answer
84,2023,"Tahuantinsuyu - name of the Inca Empire in Quechua - was divided into four parts or suyus: Chinchaysuyu (northwest of Peru and Ecuador), Antisuyu (amazonian part of the empire), Collasuyu (current Bolivia) and Condesuyu (Pacific Ocean coast) and had Cuzco, in current Peru, as its imperial capital. Officially, all ethnic groups dominated by the Incas should adopt the Quechua language, worship the Sapa Inca and the Sun and pay taxes in the form of hours of periodic work. However, it can be said that the Inca Empire was like a cultural mosaic in which various and different ethnic groups worshiped the Sapa Inca and the Sun but, simultaneously, continued to worship their local gods and also speak in their native languages.","When comparing, in the text, the aspect of territorial domination with the cultural aspects, the Incas had a posture","{'A': 'acceptable in terms of human rights.', 'B': 'admissible in terms of colonial beliefs.', 'C': 'tolerable in terms of tax regimes.', 'D': 'flexible in terms of religious customs.', 'E': 'understandable in terms of labor standards.'}",{'D': 'flexible in terms of religious customs.'},,,,,,,No,False,True,[],,HUMANITIES AND THEIR TECHNOLOGIES,ORANGE,{D: flexible in terms of religious customs.},"In the provided text, it is mentioned that the Inca Empire was like a cultural mosaic where different ethnic groups continued to worship their local gods alongside the Inca beliefs. This indicates that the Incas had a flexible posture in terms of religious customs, allowing diversity in worship practices."
85,2023,"The Fluminense fans start a movement to change the lyrics of one of the most popular songs in the tricolor stands. Groups demand the removal of the term 'filthy mulambo', in a direct provocation to Flamengo. Mulambo is a term that originated in Angola, during slavery, and they were called mulambos by the sugar cane plantation owners, the farm bosses. []",What change in social behavior does the proposal reported in the text reflect?,"{'A': 'Rejection of elitist customs.', 'B': 'Repulsion of misogynistic behaviors.', 'C': 'Condemnation of racial prejudice.', 'D': 'Criminalization of homophobic practices.', 'E': 'Challenge to macho behavior.'}",{'C': 'Condemnation of racial prejudice.'},,,,,,,No,False,True,[],,HUMANITIES AND THEIR TECHNOLOGIES,ORANGE,{C: Condemnation of racial prejudice.},"The proposal to change the lyrics of the song to remove a racially derogatory term reflects a condemnation of racial prejudice, as the term 'filthy mulambo' is considered offensive and racially discriminatory."
88,2023,"From the 16th century onwards, at least in the higher classes, the fork began to be used as an eating utensil, coming through Italy first to France and then to England and Germany, after having served, for some time, only to remove solid foods from the platter. Henry III introduced it in France, probably bringing it from Venice. His courtiers were not a little ridiculed for this 'affected' way of eating and, at first, were not very skilled in the use of the utensil: at least it was said that half of the food fell from the fork on the way from the plate to the mouth. As recently as the 17th century, the fork was still basically a luxury item, usually made of silver or gold.",The social process reported indicates the formation of an etiquette that has as its principle,"{'A': 'distinction of social classes.', 'B': 'valorization of hygiene habits.', 'C': 'exaltation of Mediterranean culture.', 'D': 'consecration of medieval traditions.', 'E': 'dissemination of manufactured products.'}",{'A': 'distinction of social classes.'},,,,,,,No,False,True,[],,HUMANITIES AND THEIR TECHNOLOGIES,ORANGE,{B: valorization of hygiene habits.},"The social process reported in the passage, where the fork was introduced as an eating utensil, indicates the formation of an etiquette that values hygiene habits, as using a fork helped in maintaining cleanliness while eating."
89,2023,"Denying the request for indispensable money for personal needs or buying goods using the person's name without their consent. Threatening to cut off resources depending on personal attitudes, hiding documents or changing bank passwords without notice. Or even prohibiting the person from working or destroying their belongings. The stories are common, but sometimes not recognized as abuse. But it is one of the five forms of conduct against women provided for in the Maria da Penha Law.","The text presents types of conduct subject to punishment, as provided for in the Maria da Penha Law, because they consist of forms of","{'A': 'defamatory action.', 'B': 'behavioral deviation.', 'C': 'prejudiced expression.', 'D': 'patrimonial violence.', 'E': 'marital disagreement.'}",{'D': 'patrimonial violence.'},,,,,,,No,False,True,[],,HUMANITIES AND THEIR TECHNOLOGIES,ORANGE,{D: patrimonial violence.},"The text describes actions like denying money, threatening, hiding documents, and destroying belongings, which are forms of patrimonial violence as per the Maria da Penha Law."
90,2023,"Behind the 'magic' of Google Assistant's ability to interpret 26 languages is a huge team of linguists distributed globally, working as subcontractors, who must tediously label training data for it to work. They earn low wages and are routinely forced to work unpaid overtime. Artificial intelligence doesn't work with a magic powder. It works through workers who tirelessly train algorithms until they automate their own jobs.",The text criticizes technological change due to the following consequence:,"{'A': 'Function diversification.', 'B': 'Population mobility.', 'C': 'Employee autonomy.', 'D': 'Production concentration.', 'E': 'Professional invisibility.'}",{'E': 'Professional invisibility.'},,,,,,,No,False,True,[],,HUMANITIES AND THEIR TECHNOLOGIES,ORANGE,{E: Professional invisibility.},"The text criticizes technological change due to the consequence of professional invisibility, as it highlights the low wages, unpaid overtime, and tedious work of linguists who train algorithms for Google Assistant."
91,2023,"It is common on airplane trips to be asked to turn off devices that involve the emission or reception of electromagnetic waves, such as cell phones. The justification given for this procedure is, among other things, the need to eliminate sources of electromagnetic signals that may interfere with the radio communications between pilots and the control tower. []",This interference will only occur if the waves emitted by the cell phone and those received by the airplane's radio,"{'A': 'are both audible.', 'B': 'have the same power.', 'C': 'have the same frequency.', 'D': 'have the same intensity.', 'E': 'propagate at different speeds.'}",{'C': 'have the same frequency.'},,,,,,,No,False,True,[],,NATURAL SCIENCES AND THEIR TECHNOLOGIES,ORANGE,{C: have the same frequency.},"The interference will only occur if the waves emitted by the cell phone and those received by the airplane's radio have the same frequency, as stated in the passage."
93,2023,"## Cafeteria adopts reusable cup made from coffee husk
A cafeteria has adopted cups made from a composition of 50 percent non-biodegradable recycled plastic and 50 percent coffee husk. The cup is reusable and returnable, as the material, similar to ceramic, withstands washing. Although it is marketed at a high price compared to a disposable plastic cup, this cafeteria allows customers to return the dirty cup and take the hot coffee served in another already clean and sanitized cup. The material of this cup also offers the comfort of not heating up on the outside. []",What are two advantages does this cup have compared to the disposable cup?,"{'A': 'Having the durability of a ceramic and being totally biodegradable.', 'B': 'Being as durable as a ceramic and having high thermal conductivity.', 'C': 'Being a poor thermal conductor and increasing biodegradable waste in nature.', 'D': 'Having low thermal conductivity and reducing non-biodegradable waste in nature.', 'E': 'Having high thermal conductivity and enabling material degradation in the environment.'}",{'D': 'Having low thermal conductivity and reducing non-biodegradable waste in nature.'},,,,,,,No,False,True,[],,NATURAL SCIENCES AND THEIR TECHNOLOGIES,ORANGE,{D: Having low thermal conductivity and reducing non-biodegradable waste in nature.},"The cup is described as similar to ceramic, which means it has low thermal conductivity and does not heat up on the outside. Additionally, the cup is made from a composition of 50 percent non-biodegradable recycled plastic and 50 percent coffee husk, which helps in reducing non-biodegradable waste in nature."
94,2023,"## A simple method to evaluate the sucrose and CO2 content in soft drinks
Excessive consumption of soft drinks is concerning, as it contributes to the increase in obesity and diabetes cases. Consider two canned soft drinks, one regular and one diet, both having the same amount of additives, except for the presence of sugar. The regular soft drink basically contains carbonated water and a large amount of sugar; whereas the diet soft drink has carbonated water and sweeteners, whose masses are very small. []","Between the two versions presented, the regular soft drink has","{'A': 'higher density.', 'B': 'lower viscosity.', 'C': 'greater volume of dissolved gas.', 'D': 'lower mass of dissolved solutes.', 'E': 'higher freezing temperature.'}",{'A': 'higher density.'},,,,,,,No,False,True,[],,NATURAL SCIENCES AND THEIR TECHNOLOGIES,ORANGE,{A: higher density.},"The regular soft drink contains a large amount of sugar, which increases its density compared to the diet soft drink that contains sweeteners with very small masses."
96,2023,"## Evaluation of genotoxic substances
### Micronuclei in tumor cells: biology and implications for tumorigenesis
The micronucleus assay is a genotoxicity evaluation test that associates the presence of micronuclei (small nuclei that appear close to the cell nuclei) with genetic damage. Micronuclei are encapsulated DNA fragments, originating from the mitotic spindle during cell division. []",Micronuclei originate from,"{'A': 'nucleoli.', 'B': 'lysosomes.', 'C': 'ribosomes.', 'D': 'mitochondria.', 'E': 'chromosomes.'}",{'E': 'chromosomes.'},,,,,,,No,False,True,[],,NATURAL SCIENCES AND THEIR TECHNOLOGIES,ORANGE,{E: chromosomes.},"Micronuclei originate from encapsulated DNA fragments, originating from the mitotic spindle during cell division, which are chromosomes."
99,2023,"## Parents with Down syndrome
### Three years after giving birth, mother with Down syndrome reveals details of her daily life
Down syndrome is a genetic alteration associated with trisomy of chromosome 21, that is, the individual has three chromosome 21 instead of a pair, as is normal. This occurs due to the union of a gamete containing one chromosome 21 with a gamete containing two chromosome 21. Although, normally, women with the syndrome are sterile, in 2008, in the countryside of São Paulo, one of them gave birth to a girl without Down syndrome.
Knowing this, a young couple, both with this syndrome, seeks a specialist doctor for genetic counseling because they want to have a baby. []","The doctor informs the couple that, regarding chromosome 21, the formed zygotes will be","{'A': 'all normal.', 'B': 'all tetrasomic.', 'C': 'only normal or tetrasomic.', 'D': 'only trisomic or tetrasomic.', 'E': 'normal, trisomic or tetrasomic.'}","{'E': 'normal, trisomic or tetrasomic.'}",,,,,,,No,False,True,[],,NATURAL SCIENCES AND THEIR TECHNOLOGIES,ORANGE,"{E: normal, trisomic or tetrasomic.}","The doctor informs the couple that, regarding chromosome 21, the formed zygotes will be either normal, trisomic, or tetrasomic due to the genetic alteration associated with Down syndrome."
102,2023,"Scientists can determine the age of a fossil less than 40,000 years old using the carbon-14 or radioactive carbon method. This is done based on the relationship between the remaining carbon-14 in the fossil and the amount of carbon-14 in a similar current species. Despite undergoing radioactive decay, the amount of carbon-14 in the atmosphere, particularly in CO2 molecules, is practically constant, due to the incidence of cosmic rays constantly hitting the Earth. Thus, as part of the carbon cycle, animals and plants maintain a practically constant amount of carbon-14 in their constitution while they are alive. However, when they die, the entry of carbon into the organism ceases and this number decreases as carbon-14 decays radioactively. The half-life of carbon-14, that is, the time required for half of the radioactive atoms in a sample to decay, is constant and approximately 5,730 years.","To discover the age of a fossil that could not be more than 40,000 years old, it is relevant to determine","{'A': 'the half-life of carbon-14.', 'B': 'if the fossil is animal or vegetable.', 'C': 'if the fossil is over 5,730 years old.', 'D': 'the amount of carbon-14 present in the fossil.', 'E': 'the relationship between the amounts of carbon-14 in a part of the fossil and in the whole fossil.'}",{'D': 'the amount of carbon-14 present in the fossil.'},,,,,,,No,False,True,[],,NATURAL SCIENCES AND THEIR TECHNOLOGIES,ORANGE,{D: the amount of carbon-14 present in the fossil.},"To determine the age of a fossil using the carbon-14 method, it is crucial to measure the amount of carbon-14 present in the fossil. This is because the relationship between the remaining carbon-14 in the fossil and the initial amount of carbon-14 in a similar current species is used to calculate the age of the fossil based on radioactive decay."
105,2023,"In a food industry, for the production of dulce de leche, a hollow-walled vat with an inlet for water vapor at 120 degrees Celsius and an outlet for liquid water in equilibrium with the vapor at 100 degrees Celsius is used. As it passes through the hollow part of the vat, the water vapor turns into liquid, releasing energy. The wall transfers this energy to the interior of the vat, resulting in water evaporation and consequent product concentration.","In the process of product concentration, energy from","{'A': 'only the latent heat of vaporization.', 'B': 'only the latent heat of condensation.', 'C': 'sensible heat and latent heat of vaporization.', 'D': 'sensible heat and latent heat of condensation.', 'E': 'latent heat of condensation and latent heat of vaporization.'}",{'D': 'sensible heat and latent heat of condensation.'},,,,,,,No,False,True,[],,NATURAL SCIENCES AND THEIR TECHNOLOGIES,ORANGE,{A: only the latent heat of vaporization.},"In the process of product concentration, energy from only the latent heat of vaporization is utilized."
106,2023,"Gasoline is a mixture of saturated hydrocarbons containing 8 to 12 carbon atoms. In addition, high-performance gasoline must contain high levels of branched-chain hydrocarbons, in order to resist compression and ignite only when the spark plug triggers an electric spark in the engine. The compounds that can be used as fuels are presented in the table below.","Among these compounds, the one that will provide the best performance as a fuel is","{'A': '1.', 'B': '2.', 'C': '3.', 'D': '4.', 'E': '5.'}",{'C': '3.'},,,,,,,No,False,True,[],,NATURAL SCIENCES AND THEIR TECHNOLOGIES,ORANGE,{C: 3.},"To determine the compound that will provide the best performance as a fuel, we need to look for the compound with high levels of branched-chain hydrocarbons, which help resist compression and ignite effectively. Among the options provided, option '3.' is likely to be the best choice for high-performance gasoline."
107,2023,"## Urban cleaning booklet
According to the Federal Constitution, it is the responsibility of municipalities to manage urban cleaning and waste collection services (garbage). However, there are reports that part of this garbage ends up being incinerated, releasing toxic substances into the environment and causing accidents by explosions, especially when aerosol containers are incinerated (for example: deodorants, insecticides, and repellents). The high temperature causes the vaporization of all the contents inside this type of container, increasing the pressure inside it until the packaging explodes.
Suppose a metallic aerosol container with a capacity of 100 milliliters, containing 0.1 mol of gaseous products at a temperature of 650 degrees Celsius at the time of the explosion.
Consider: R = 0.082 (L⋅atm)/(mol⋅K). []","The pressure, in atmospheres, inside the container at the time of the explosion, is closest to","{'A': '756.', 'B': '533.', 'C': '76.', 'D': '53.', 'E': '13.'}",{'C': '76.'},,,,,,,No,False,True,[],,NATURAL SCIENCES AND THEIR TECHNOLOGIES,ORANGE,{A: 756.},"To find the pressure inside the container, we can use the ideal gas law formula: PV = nRT. Given V = 100 mL = 0.1 L, n = 0.1 mol, R = 0.082 (L⋅atm)/(mol⋅K), and T = 650 degrees Celsius = 923 K. Plugging in these values and solving for P, we get P = (nRT)/V = (0.1 mol * 0.082 (L⋅atm)/(mol⋅K) * 923 K) / 0.1 L = 756 atm. Therefore, the pressure inside the container at the time of the explosion is closest to 756 atm, which corresponds to option A."
112,2023,"## The aircraft crew member and ionizing radiation
Cosmic rays are sources of potentially dangerous ionizing radiation for the human body. To quantify the dose of radiation received, the sievert is used, defined as the unit of energy received per unit of mass. Exposure to radiation from cosmic rays increases with altitude, which can pose a problem for aircraft crews. Recently, accurate measurements of ionizing radiation doses were taken for flights between Rio de Janeiro and Rome. The results have indicated that the average dose of radiation received during the cruise phase (which usually represents 80 percent of the total flight time) of this intercontinental route is 2 microsieverts per hour. International civil aviation standards limit the working time for crews operating on intercontinental flights to 1,000 hours per year. Consider that the dose of ionizing radiation for a chest X-ray is estimated at 0.2 millisieverts. []",How many chest X-rays does the dose of ionizing radiation to which a crew member operating on the Rio de Janeiro-Rome route is exposed over a year correspond to?,"{'A': '8', 'B': '10', 'C': '80', 'D': '100', 'E': '1 000'}",{'A': '8'},,,,,,,No,False,True,[],,NATURAL SCIENCES AND THEIR TECHNOLOGIES,ORANGE,{C: 80},"To calculate the total dose of ionizing radiation for a crew member operating on the Rio de Janeiro-Rome route, we first find the dose per hour (2 microsieverts). Then, we calculate the total dose for the cruise phase (2 microsieverts per hour * 1000 hours = 2000 microsieverts). Converting this to millisieverts (2000 microsieverts = 2 millisieverts). Since the dose of ionizing radiation for a chest X-ray is 0.2 millisieverts, we divide the total dose by the dose per chest X-ray (2 millisieverts / 0.2 millisieverts = 10). Therefore, the crew member is exposed to the equivalent of 10 chest X-rays over a year."
116,2023,"Bluetooth is a short-range wireless communication technology, present in different consumer electronic devices. It allows different electronic devices to connect and exchange data with each other. In the bluetooth standard, called Class 2, the antennas transmit signals with a power of 2.4 milliwatts and make it possible to connect two devices distanced up to 10 meters. Consider that these antennas behave as point sources that emit spherical electromagnetic waves and that the signal intensity is calculated by power per unit area. Consider 3 as an approximate value for pi. []","For the bluetooth signal to be detected by the antennas, the minimum value of its intensity, in watts per square meter, is closest to","{'A': '2.0 × 10^–6', 'B': '2.0 × 10^–5', 'C': '2.4 × 10^–5', 'D': '2.4 × 10^–3', 'E': '2.4 × 10^–1'}",{'A': '2.0 × 10^–6'},,,,,,,No,False,True,[],,NATURAL SCIENCES AND THEIR TECHNOLOGIES,ORANGE,{C: 2.4 × 10^–5},"To calculate the intensity of the bluetooth signal, we can use the formula: Intensity = Power / (4 * pi * distance^2). Substituting the values: Power = 2.4 mW = 2.4 × 10^-3 W, distance = 10 meters. Intensity = (2.4 × 10^-3) / (4 * 3 * (10)^2) = 2.4 × 10^-5 W/m^2. Therefore, the closest value is 2.4 × 10^-5."
117,2023,"Messenger RNA (mRNA) vaccine technology has been investigated for years. Scientific advances in molecular genetics have allowed the development of a vaccine to control the COVID-19 pandemic caused by the RNA virus SARS-CoV-2. The mRNA vaccine has gene sequences from the virus. However, because it is very unstable, mRNA must be coated with a lipid envelope that prevents its degradation and favors its action. In this way, mRNA will perform its specific function by acting in the same cellular compartment as always.",The immunization produced by this type of vaccine is achieved through,"{'A': 'stimulation of leukocytes induced by the lipid envelope containing mRNA.', 'B': 'mRNA acting as a virus sequester to the extracellular environment.', 'C': 'translation of mRNA into viral protein, triggering the antigenic response.', 'D': 'competition between the vaccine mRNA and the viral RNA for ribosome sites.', 'E': 'incorporation of viral mRNA into the host's genome, generating a new phenotype.'}","{'C': 'translation of mRNA into viral protein, triggering the antigenic response.'}",,,,,,,No,False,True,[],,NATURAL SCIENCES AND THEIR TECHNOLOGIES,ORANGE,"{C: translation of mRNA into viral protein, triggering the antigenic response.}","The mRNA vaccine technology works by introducing gene sequences from the virus into the body. The mRNA is translated into viral proteins, triggering an immune response that leads to immunization."
118,2023,"In in vitro fertilization, sperm are added to female gametes removed from a woman. After the incubation period, fertilization is favored by the action of enzymes. In a procedure performed, it was observed that none of the female gametes were fertilized and, subsequently, it was found that a cocktail of acrosome enzyme inhibitors had been mistakenly added instead of one of the nutrients constituting the culture medium.",The cocktail of inhibitors prevented the,"{'A': 'formation of the male pronucleus.', 'B': 'onset of zygote mitotic division.', 'C': 'completion of the second meiotic division of the oocyte.', 'D': 'passage of the sperm through the corona radiata and zona pellucida.', 'E': 'fusion of the plasma membranes of the oocyte and sperm.'}",{'D': 'passage of the sperm through the corona radiata and zona pellucida.'},,,,,,,No,False,True,[],,NATURAL SCIENCES AND THEIR TECHNOLOGIES,ORANGE,{E: fusion of the plasma membranes of the oocyte and sperm.},"The cocktail of acrosome enzyme inhibitors prevented the fusion of the plasma membranes of the oocyte and sperm, leading to the failure of fertilization."
119,2023,"The induction stove operates from the emergence of an induced electric current in the bottom of the pan, with consequent transformation of electrical energy into heat by Joule effect. The main advantage of these stoves is the energy efficiency, which is substantially higher than that of conventional stoves.",The electric current mentioned is induced by,"{'A': 'induction', 'B': 'conduction.', 'C': 'variable electric field.', 'D': 'variable magnetic field.', 'E': 'electromagnetic resonance.'}",{'D': 'variable magnetic field.'},,,,,,,No,False,True,[],,NATURAL SCIENCES AND THEIR TECHNOLOGIES,ORANGE,{D: variable magnetic field.},"The electric current mentioned is induced by a variable magnetic field, according to the principle of electromagnetic induction."
122,2023,"Ketones are part of olfactory families found in many foods. The molecule hexan-3-one is an example of these volatile compounds responsible for the aroma, and can be obtained through energetic processes carried out in an acidic medium, in the presence of oxidants such as potassium permanganate. []","To produce this volatile compound in the laboratory, one must oxidize the molecule of","{'A': 'hexanal.', 'B': 'hexan-1-ol.', 'C': 'hexan-3-ol.', 'D': 'hex-1-en-1-ol.', 'E': 'hexanoic acid.'}",{'C': 'hexan-3-ol.'},,,,,,,No,False,True,[],,NATURAL SCIENCES AND THEIR TECHNOLOGIES,ORANGE,{B: hexan-1-ol},"The molecule hexan-3-one can be obtained through energetic processes carried out in an acidic medium, in the presence of oxidants such as potassium permanganate. To produce this volatile compound, one must oxidize the molecule of hexan-1-ol."
