id,year,context,question,options,correct_answer,CE,DS,EK,IC,MR,TC,image,IU,ledor,figures,description,area,cor,system_answer,steps_answer
44,2023,"## Chronicle of the murdered house
Lúcio Cardoso
Even that time I could see the bizarreness of the customs that constituted the more or less constant laws of his world: as I approached, I verified that Mr. Timóteo, fat and sweaty, wore a dress with fringes and sequins that had belonged to his mother. The bodice descended excessively tight at the waist, and here and there a little of the trapped flesh burst through the seam, fraying the fabric and making the pleasure of dressing in that way a true kind of torment. He moved slowly, swaying all his fringes and vigorously fanning himself with one of those sandalwood wooden fans, which enveloped him in a nauseating wave of perfume. I'm not sure what he had put on his head, it looked more like a turban or a hat without brims from which vigorous strands of blond hair emerged. As was also his custom, he wore painted face - and for this, as well as for his clothing, he had taken over all the wardrobe left by his mother, also in her time famous for the extravagance with which she dressed - which undoubtedly made his huge nose stand out, so characteristic of the Meneses family. []","Through the voice of a housemaid, the description of one of the family members exemplifies the renewal of urban fiction in the 1950s, observed here in","{'A': 'choice of terms and expressions with ambiguous meanings.', 'B': 'social criticism inspired by living with the employers.', 'C': 'impressionistic description of the character's fetish.', 'D': 'presence of a narrative focus of imprecise character.', 'E': 'mysterious ambiance of the relationships between family members.'}",{'C': 'impressionistic description of the character's fetish.'},,,,,,,No,False,True,[],,"LANGUAGES, CODES AND THEIR TECHNOLOGIES",ORANGE,{C: impressionistic description of the character's fetish.},"The passage describes Mr. Timóteo's eccentric appearance and behavior in a vivid and detailed manner, focusing on his clothing, accessories, and physical features. This type of detailed and vivid description aligns with the impressionistic style, which emphasizes capturing the essence or impression of a character rather than precise details."
45,2023,"## Morning Sunflower (fragment)
Mário de Andrade
Your curious finger follows me slowly on the face
The furrows, the shadows hurt by where life has passed.
What silence, hold me... What triumphant deviation from the truth,
What slow circles in the pond where a free wing grazed...
I had four eternal loves...
The first was a maiden girl,
The second... eclipse, talking ox, cataclysm,
The third was the rich lady,
The fourth is you... And finally I rested from [my worries []","Before the other, the lyrical self reveals, in the strength of the evoked memories, the","{'A': 'shame of the marks caused by the passage of time.', 'B': 'indecision in the face of the affective possibilities of the present.', 'C': 'serenity sedimented by the peaceful surrender to desire.', 'D': 'frustration caused by the desire to return to the past.', 'E': 'availability for the exploration of ephemeral pleasure.'}",{'C': 'serenity sedimented by the peaceful surrender to desire.'},,,,,,,No,False,True,[],,"LANGUAGES, CODES AND THEIR TECHNOLOGIES",ORANGE,{C: serenity sedimented by the peaceful surrender to desire.},"The poem fragment describes the speaker's four eternal loves, with the fourth love being the addressee. The lyrical self reveals a sense of serenity and peaceful surrender to desire when talking about the fourth love, which is indicated by the slow circles in the pond where a free wing grazed. This aligns with option C."
46,2023,"## TEXT 1
Room of Junk: Diary of a Slumdweller
Carolina Maria de Jesus
How horrible it is to see a child eating and asking: 'Is there more?' This word 'more' keeps oscillating inside a mother's brain as she looks at the pots and there is no more.
## TEXT 2
The experience of seeing hungry children in the 1950s, described by Carolina, is lived in Brazil in 2021 by a resident of Petrolândia, in Pernambuco. 'I used to work as a hairdresser's assistant, but the lady who owned the salon closed it. I was supporting myself with the aid I had, but now I was not included. Sometimes people help me with food for my children. Occasionally, I find some odd job to do, but it is very rare. There are days when I don't even have my baby's milk.' []","Considering the Brazilian reality, the texts approach each other by presenting a reflection on","{'A': 'recurrence of poverty.', 'B': 'health planning.', 'C': 'overcoming scarcity.', 'D': 'constancy of the economy.', 'E': 'romanticization of need.'}",{'A': 'recurrence of poverty.'},,,,,,,No,False,True,[],,HUMANITIES AND THEIR TECHNOLOGIES,ORANGE,{A: recurrence of poverty.},"The texts approach each other by presenting a reflection on the recurrence of poverty, as both describe situations where individuals struggle to provide basic necessities like food for their children due to economic hardships."
47,2023,"In southern Bahia, since the 18th century, there have been records of a type of agroforestry system. To this day, this system is a striking feature of the region's landscape, known as cabruca, which consists of cultivating cocoa under the canopy of the native forest. This cocoa cultivation system (thanks to the species' shade tolerance) is considered wildlife-friendly, as it excels in terms of biodiversity conservation when compared to other tropical plantations (monocultures of oil palm, rubber, or coffee), agriculture, or pastures.",The presented productive practice is an example of,"{'A': 'commercial diffusion of temporary crops.', 'B': 'sustainable use of natural resources.', 'C': 'technological expansion of intensive livestock farming.', 'D': 'diet standardization of traditional peoples.', 'E': 'logistical modernization of conventional plantations.'}",{'B': 'sustainable use of natural resources.'},,,,,,,No,False,True,[],,HUMANITIES AND THEIR TECHNOLOGIES,ORANGE,{B: sustainable use of natural resources.},"The cabruca system described in the passage involves cultivating cocoa under the canopy of the native forest, which is considered wildlife-friendly and excels in biodiversity conservation. This practice aligns with the concept of sustainable use of natural resources."
48,2023,"## The boy Ricardo
José Lins do Rêgo
The farmer, the woman, and four children, sleeping in a shack with four coffin walls, covered in zinc. The water from the mangrove, at high tide, entered the house. The sandflies at night swarmed over the children's bodies. The mangrove sometimes stank, and the vultures gathered there looking for snacks. Near the street, they washed cowhide, goat skin for a Spanish tannery. Poisoned fish died, and when the tide went out, the vultures filled their crops, pecked at the mud, strolled through the puddles by the huts in Recife.",The urban agglomeration represented in the text results in,"{'A': 'conservation of the rural environment.', 'B': 'growth of riparian vegetation.', 'C': 'interference of the geographical space.', 'D': 'balance of the city environment.', 'E': 'control of animal proliferation.'}",{'C': 'interference of the geographical space.'},,,,,,,No,False,True,[],,HUMANITIES AND THEIR TECHNOLOGIES,ORANGE,{C: interference of the geographical space.},"The text describes how the urban agglomeration, represented by the city environment and activities like tannery and washing cowhide near the street, interferes with the geographical space of the rural environment, leading to changes and impacts on the natural surroundings."
49,2023,"They were pioneers of women's rights in Afghanistan. Fierce defenders of the law, they sought justice for the most marginalized. But now, more than 220 Afghan female judges are in hiding out of fear of retaliation under the Taliban regime. One of them sentenced hundreds of men for violence against women, including rape, murder, and torture. But a few days after the Taliban took control of their city and thousands of convicted criminals were released from prison, death threats began. The country has always been considered one of the most difficult and dangerous places in the world for women. According to studies by non-governmental organizations, about 87 percent of women and girls will be victims of abuse during their lifetime.",The text highlights a representative situation of,"{'A': 'affront to social structures.', 'B': 'disregard for religious values.', 'C': 'transgression of moral norms.', 'D': 'disrespect for human dignity.', 'E': 'opposition to hierarchical principles.'}",{'D': 'disrespect for human dignity.'},,,,,,,No,False,True,[],,HUMANITIES AND THEIR TECHNOLOGIES,ORANGE,{D: disrespect for human dignity.},"The text describes how Afghan female judges who were pioneers of women's rights and sought justice for the marginalized are now in hiding due to fear of retaliation under the Taliban regime. This situation, where these judges are threatened and forced into hiding for upholding the law and seeking justice, reflects a clear disrespect for their human dignity."
50,2023,"Enormous South Korean loudspeakers installed on the border with the North used to broadcast everything from K-pop songs (as South Korean pop is called) to weather reports and critical news about the communist neighbor. The North often practices a similar activity, broadcasting critical speeches to Seoul and allies through its loudspeakers. During the 1980s, the South Korean government built a 97-meter-high mast to hoist its flag in the village of Daesong-dong, on the border with the North. The North responded by building an even taller mast (160 meters) in the border city of Gijung-dong. 'These demonstrations are a competitive and important outlet between the two sides, outside of a possible military conflict,' says analyst Ankit Panda. []",The cited acts of competition have their historical origins linked to a context of,"{'A': 'cultural-identity dominance of social actors.', 'B': 'ethnic-racial disputes of traditional peoples.', 'C': 'political-ideological divergences of state agents.', 'D': 'economic-financial imposition of private companies.', 'E': 'ecologically-sustainable protests of environmental entities.'}",{'C': 'political-ideological divergences of state agents.'},,,,,,,No,False,True,[],,HUMANITIES AND THEIR TECHNOLOGIES,ORANGE,{C: political-ideological divergences of state agents.},"The cited acts of competition between North and South Korea, involving broadcasting critical messages through loudspeakers and building taller masts, have their historical origins linked to a context of political-ideological divergences of state agents."
51,2023,"## Interdisciplinary studies broaden knowledge about chinesice in the baroque of Minas Gerais
Silk, aromatic woods and textiles, works of art, wool, crystals and many, many pieces of porcelain arrived in Brazil during the 17th and 18th centuries. The opulence provided by gold made these items even more present in mining cities such as Ouro Preto, Mariana and Sabará. These objects inspired the creation of chinesices, a term that designates a type of art that evokes Chinese motifs, present in various baroque churches in Minas Gerais. In Brazil, it is very likely that the inspiration for the paintings in the baroque churches with birds, elephants, tigers, mandarins and pagodas was taken from engravings, fabrics, furniture and, mainly, from the Chinese porcelains that circulated freely in a society enriched by the trade of gold and gemstones. []",The development of the artistic process described in the text was made possible by,"{'A': 'architectural representation.', 'B': 'transcontinental exchange.', 'C': 'economic dependence.', 'D': 'government intervention.', 'E': 'aesthetic pattern.'}",{'B': 'transcontinental exchange.'},,,,,,,No,False,True,[],,HUMANITIES AND THEIR TECHNOLOGIES,ORANGE,{B: transcontinental exchange.},"The text mentions that the objects that inspired the creation of chinesices in Minas Gerais were brought to Brazil during the 17th and 18th centuries. This transcontinental exchange of goods like silk, aromatic woods, textiles, and Chinese porcelains made the development of the artistic process possible."
52,2023,"## Txai Suruí, Indigenous Youth leadership, delivers her speech at the opening of COP-26
“The climate is warming, the animals are disappearing, the rivers are dying, and our crops are not blooming as they did in the past. The Earth is speaking: it tells us that we are running out of time.” []",The indigenous leader's speech highlights a global problem related to,"{'A': 'traditional management.', 'B': 'residual recycling.', 'C': 'conscious consumption.', 'D': 'predatory exploitation.', 'E': 'energy reuse.'}",{'D': 'predatory exploitation.'},,,,,,,No,False,True,[],,HUMANITIES AND THEIR TECHNOLOGIES,ORANGE,{D: predatory exploitation.},"The indigenous leader's speech highlights a global problem related to predatory exploitation, as she mentions the negative impacts on the environment such as warming climate, disappearing animals, dying rivers, and failing crops."
55,2023,"## New Fashion Mail, 1853
Happy times were these! The girls went to mass at dawn. During the day no one saw them and if any, on a feast day, wanted to stroll with her grandmother or aunt, she had to go in little chairs. Our elders have every reason to cry for those times, when daughters could not write, and therefore did not send or receive little notes. []","From the author's perspective, which factors led to changes in socio-family traditions and customs in the 19th century?","{'A': 'Reading habits and regional mobility.', 'B': 'Circulation of printed materials and religious traffic.', 'C': 'Valorization of language and foreign immigration.', 'D': 'Literacy practices and cultural transformation.', 'E': 'Flexibilization of teaching and pedagogical reform.'}",{'D': 'Literacy practices and cultural transformation.'},,,,,,,No,False,True,[],,HUMANITIES AND THEIR TECHNOLOGIES,ORANGE,{D: Literacy practices and cultural transformation.},"The passage mentions that daughters in the past could not write, which implies low literacy rates. This lack of ability to write led to the inability to send or receive little notes, indicating a cultural transformation due to literacy practices."
56,2023,"In the Cerrado, local knowledge is increasingly being subordinated to the logic of agribusiness. On one hand, capital imposes biotechnological knowledge as a mechanism for universalizing agricultural practices and new technologies, and on the other hand, the capitalist model subordinates men and women to the logic of the market. Thus, water, seeds, minerals, lands (common goods) become private property. Furthermore, there are other negative factors, such as heavy mechanization, the 'pragatization' of human and non-human beings, symbolic violence, overexploitation, poison rains, and violence against individuals.",The elements described in the text regarding the territorialization of production demonstrate that there is a,"{'A': 'encirclement of peasants, making it impossible to maintain conditions for life.', 'B': 'neglect of landowners, impacting the planting of food for export.', 'C': 'disregard for wage earners, affecting the engagement of unions for the worker.', 'D': 'disrespect for rulers, compromising the creation of jobs for the farmer.', 'E': 'harassment of entrepreneurs, hindering the investment in machinery for production.'}","{'A': 'encirclement of peasants, making it impossible to maintain conditions for life.'}",,,,,,,No,False,True,[],,HUMANITIES AND THEIR TECHNOLOGIES,ORANGE,"{A: encirclement of peasants, making it impossible to maintain conditions for life.}","The text describes how local knowledge in the Cerrado is being subordinated to agribusiness, leading to the privatization of common goods like water, seeds, minerals, and lands. This process results in heavy mechanization, symbolic violence, and overexploitation. The encirclement of peasants mentioned in option A aligns with the negative impacts of this territorialization of production."
57,2023,"## TEXT 1
With a population of 25 million inhabitants (about 60 percent of Muslim minorities, mainly of Uighur ethnicity), Xinjiang is a strategic region for China. It borders eight countries, is a crucial artery of the Chinese Belt and Road mega-infrastructure project, and has the largest national reserves of coal and natural gas.
## TEXT 2
Among the provinces of the Western Region, Xinjiang stands out by receiving more than 1.7 million migrants between 2000 and 2010. The main reason for this migratory flow is that the government provides subsidies to the population aiming to increase the proportion of Han Chinese in relation to the local population of Turkish and Muslim ethnicities. []",The demographic policy for the province mentioned in the texts is part of the following strategic action of the Chinese government:,"{'A': 'Promote rural occupation.', 'B': 'Favor religious freedom.', 'C': 'Decentralize public management.', 'D': 'Encourage cultural plurality.', 'E': 'Ensure territorial integrity.'}",{'E': 'Ensure territorial integrity.'},,,,,,,No,False,True,[],,HUMANITIES AND THEIR TECHNOLOGIES,ORANGE,{E: Ensure territorial integrity.},"The text mentions that the Chinese government aims to increase the proportion of Han Chinese in Xinjiang, which is a strategic region for China. This demographic policy aligns with the strategic action of ensuring territorial integrity, as it involves maintaining control over the region's demographics to strengthen China's presence and influence in Xinjiang."
58,2023,"## Dialectic of Enlightenment
Theodor Adorno and Max Horkheimer
Entertainment is the prolongation of work under late capitalism. It is sought by those who want to escape the mechanized work process in order to face it again. However, at the same time, mechanization has gained such power over the individual in their leisure time and happiness, it determines so deeply the production of goods intended for entertainment that this individual can no longer perceive anything other than copies that reproduce the work process itself. []","In the text, leisure time is conceived as","{'A': 'consumption of cultural products elaborated in the same productive system of capitalism.', 'B': 'way to realize the various potentialities of human nature.', 'C': 'alternative to balance psychological tensions of everyday life.', 'D': 'promotion of satisfaction of artificial needs.', 'E': 'mechanism for organizing leisure and pleasure.'}",{'A': 'consumption of cultural products elaborated in the same productive system of capitalism.'},,,,,,,No,False,True,[],,HUMANITIES AND THEIR TECHNOLOGIES,ORANGE,{A: consumption of cultural products elaborated in the same productive system of capitalism.},"In the text, leisure time is conceived as a time where individuals consume entertainment that is produced within the same capitalist system, leading to the perception of copies that reproduce the work process itself. This aligns with option A: consumption of cultural products elaborated in the same productive system of capitalism."
60,2023,Whoever embarks on the path of asking for forgiveness must be ready to hear a word of refusal. To enter the atmosphere of forgiveness is to accept measuring oneself against the ever-open possibility of the unforgivable. Forgiveness asked for is not forgiveness one is entitled to [due to]. It is with the price of these reservations that the greatness of forgiveness is manifested. [],The reflection on forgiveness presented in the text is based on,"{'A': 'particular rejection supported by the desire for power.', 'B': 'subjective decision determined by divine will.', 'C': 'freedom mitigated by the predestination of the spirit.', 'D': 'human choices defined by empirical knowledge.', 'E': 'interpersonal relationships mediated by individuals' autonomy.'}",{'E': 'interpersonal relationships mediated by individuals' autonomy.'},,,,,,,No,False,True,[],,HUMANITIES AND THEIR TECHNOLOGIES,ORANGE,{E: interpersonal relationships mediated by individuals' autonomy.},"The text discusses forgiveness as a concept related to interpersonal relationships and individuals' autonomy, which aligns with option E."
61,2023,"Overcoming the history of slavery as the main mark of the black trajectory in the country has been a theme for those dedicated to researching the African origins heritage to Brazilian culture. To this effort of reconstructing the country's own history, is now added the creation of the digital platform Ancestralities. 'The history of blacks in Brazil will continue to be told, and every step we take backwards is a step forward,' says Márcio Black, the platform's creator, about the study of figures still hidden by the historical perspective imposed by the colonizers of America.","Regarding the knowledge about Brazilian cultural formation, initiatives like the one described in the text favor the","{'A': 'recovery of traditionalism.', 'B': 'stimulus to anthropocentrism.', 'C': 'reinforcement of ethnocentrism.', 'D': 'rescue of theocentrism.', 'E': 'critique of eurocentrism.'}",{'E': 'critique of eurocentrism.'},,,,,,,No,False,True,[],,HUMANITIES AND THEIR TECHNOLOGIES,ORANGE,{E: critique of eurocentrism.},"The text mentions that the digital platform Ancestralities aims to reconstruct the country's own history, which implies a critique of eurocentrism as it focuses on researching African origins heritage to Brazilian culture."
62,2023,"## The Palestine War
Written during the First World War, the following excerpt is part of the letter sent by the British Foreign Secretary, Sir Arthur James Balfour, to banker Lord Rothschild, president of the Zionist League, on November 2, 1917. The letter became known as the Balfour Declaration:
""His Majesty's government view with favour the establishment in Palestine of a national home for the Jewish people, and will use their best endeavours to facilitate the achievement of this object, it being clearly understood that nothing shall be done which may prejudice the civil and religious rights of existing non-Jewish communities in Palestine."" []",The analysis of the result of the process in question reveals that the English government was unable to ensure its objective of,"{'A': 'promote social welfare.', 'B': 'negotiate Muslim support.', 'C': 'mediate territorial conflicts.', 'D': 'encourage regional cooperation.', 'E': 'combat autocratic governments.'}",{'C': 'mediate territorial conflicts.'},,,,,,,No,False,True,[],,HUMANITIES AND THEIR TECHNOLOGIES,ORANGE,{C: mediate territorial conflicts.},The Balfour Declaration aimed at establishing a national home for the Jewish people in Palestine without prejudicing the rights of existing non-Jewish communities. The English government's objective was related to mediating territorial conflicts in the region.
63,2023,"## TEXT 1
Pedagogy of autonomy
Paulo Freire
As a conscious presence in the world, I cannot escape the ethical responsibility in my movement in the world. If I am a pure product of genetic, cultural, or class determination, I am irresponsible for what I do in my movement in the world, and if I lack responsibility, I cannot speak of ethics.
## TEXT 2 []","Paulo Freire built a pedagogy of hope. In his conception, history is not something ready and finished. The structures of oppression and inequalities, although naturalized, are socially and historically constructed. Hence the importance of students becoming aware of their reality in order to transform it. Based on the concept of pedagogical ethics present in the texts, students become responsible for","{'A': 'sociopolitical participation.', 'B': 'aesthetic-cultural definition.', 'C': 'local economic competition.', 'D': 'maintenance of the school system.', 'E': 'individual mobility empowerment.'}",{'A': 'sociopolitical participation.'},,,,,,,No,False,True,[],,HUMANITIES AND THEIR TECHNOLOGIES,ORANGE,{A: sociopolitical participation.},"Based on the concept of pedagogical ethics present in the texts, students become responsible for sociopolitical participation as they need to be aware of their reality in order to transform it."
64,2023,"The Himalayan Mountain Range is over 50 million years old, being classified as the largest mountain range on the planet. Originating from the Sanskrit language, common in the region, its name means 'abode of snow'. In this mountain range, you can find the fifteen highest mountains in the world. In total, there are over a hundred peaks, with altitudes well above 7,000 meters. Mount Everest, considered the highest point on Earth, stands at no less than 8,848 meters in altitude, and continues to grow at approximately 0.8 millimeters each year.",What natural dynamic is responsible for the presented phenomenon?,"{'A': 'Volcanic lava flow.', 'B': 'Meeting of tectonic plates.', 'C': 'Action of chemical weathering.', 'D': 'Sedimentation from wind erosion.', 'E': 'Melting of glacial ice.'}",{'B': 'Meeting of tectonic plates.'},,,,,,,No,False,True,[],,HUMANITIES AND THEIR TECHNOLOGIES,ORANGE,{B: Meeting of tectonic plates.},"The natural dynamic responsible for the phenomenon described in the text is the meeting of tectonic plates, which leads to the formation and growth of mountain ranges like the Himalayas."
